{
  "$schema": "schema/awesome.schema.json",
  "list": {
    "title": "Awesome Go",
    "repo": "floatdrop/awesome-go",
    "branch": "main",
    "description": "A short, hand-curated list of Go libraries and tools that are actually worth using. Not a directory of everything that exists.",
    "podium": 3
  },
  "policy": {
    "min_age_days": 90,
    "min_stars": 200,
    "max_inactive_days": 365,
    "max_description_length": 100,
    "require_license": true,
    "require_go": true,
    "allow_forks": false
  },
  "categories": [
    {
      "id": "web-frameworks",
      "name": "Web Frameworks & Routers",
      "description": "HTTP servers, routers and full-stack web frameworks."
    },
    {
      "id": "cli",
      "name": "Command Line",
      "description": "Argument parsing, terminal UIs and everything else for building CLIs."
    },
    {
      "id": "configuration",
      "name": "Configuration",
      "description": "Loading settings from files, environment variables and flags."
    },
    {
      "id": "logging",
      "name": "Logging",
      "description": "Structured and leveled logging."
    },
    {
      "id": "testing",
      "name": "Testing",
      "description": "Assertions, mocks, fixtures and integration test helpers."
    },
    {
      "id": "databases",
      "name": "Databases & SQL",
      "description": "Drivers, query builders, ORMs, migrations and embedded stores."
    },
    {
      "id": "serialization",
      "name": "Serialization",
      "description": "JSON, YAML, TOML, MessagePack and friends."
    },
    {
      "id": "validation",
      "name": "Validation",
      "description": "Validating structs and inputs."
    },
    {
      "id": "dependency-injection",
      "name": "Dependency Injection",
      "description": "Wiring applications together."
    },
    {
      "id": "concurrency",
      "name": "Concurrency",
      "description": "Goroutine pools, structured concurrency and synchronization helpers."
    },
    {
      "id": "caching",
      "name": "Caching",
      "description": "In-memory caches and eviction policies."
    },
    {
      "id": "http-clients",
      "name": "HTTP Clients",
      "description": "Making requests with retries, tracing and convenience."
    },
    {
      "id": "messaging",
      "name": "Messaging & Queues",
      "description": "Message brokers, streaming platforms and task queues."
    },
    {
      "id": "rpc-and-api",
      "name": "RPC & API",
      "description": "gRPC, RPC frameworks, GraphQL and OpenAPI tooling."
    },
    {
      "id": "auth",
      "name": "Authentication & Authorization",
      "description": "Tokens, sessions, OAuth and access control."
    },
    {
      "id": "observability",
      "name": "Observability",
      "description": "Metrics, tracing and instrumentation."
    },
    {
      "id": "text-and-templates",
      "name": "Text, HTML & Templates",
      "description": "Parsing and generating markup and text."
    },
    {
      "id": "utilities",
      "name": "Utilities",
      "description": "General-purpose helpers that end up in every project."
    },
    {
      "id": "developer-tools",
      "name": "Developer Tools",
      "description": "Linters, build tools, debuggers and code generators."
    }
  ],
  "entries": [
    {
      "repo": "99designs/gqlgen",
      "description": "Schema-first GraphQL server generator.",
      "category": "rpc-and-api",
      "added": "2026-09-12"
    },
    {
      "repo": "a-h/templ",
      "description": "Language for type-safe HTML components that compile to Go code.",
      "category": "text-and-templates",
      "added": "2026-09-12"
    },
    {
      "repo": "air-verse/air",
      "description": "Live reload for development.",
      "category": "developer-tools",
      "added": "2026-09-12"
    },
    {
      "repo": "alecthomas/kong",
      "description": "Command-line parser driven by struct tags.",
      "category": "cli",
      "added": "2026-09-12"
    },
    {
      "repo": "alexedwards/scs",
      "description": "HTTP session management with pluggable stores.",
      "category": "auth",
      "added": "2026-09-12"
    },
    {
      "repo": "allegro/bigcache",
      "description": "Efficient in-memory cache for gigabytes of data without GC overhead.",
      "category": "caching",
      "added": "2026-09-12"
    },
    {
      "repo": "apache/casbin",
      "description": "Authorization library supporting ACL, RBAC and ABAC models.",
      "category": "auth",
      "added": "2026-09-12"
    },
    {
      "repo": "avast/retry-go",
      "description": "Simple retry mechanism with configurable backoff.",
      "category": "utilities",
      "added": "2026-09-12"
    },
    {
      "repo": "bufbuild/buf",
      "description": "Protobuf build tool with linting, breaking change detection and code generation.",
      "category": "developer-tools",
      "added": "2026-09-12"
    },
    {
      "repo": "BurntSushi/toml",
      "description": "Parser and encoder for TOML with reflection-based mapping to structs.",
      "category": "serialization",
      "added": "2026-09-12"
    },
    {
      "repo": "bytedance/sonic",
      "description": "JSON serialization and deserialization accelerated with JIT and SIMD.",
      "category": "serialization",
      "added": "2026-09-12"
    },
    {
      "repo": "caarlos0/env",
      "description": "Parse environment variables into structs using tags.",
      "category": "configuration",
      "added": "2026-09-12"
    },
    {
      "repo": "cenkalti/backoff",
      "description": "Exponential backoff algorithm with retries and contexts.",
      "category": "utilities",
      "added": "2026-09-12"
    },
    {
      "repo": "charmbracelet/bubbletea",
      "description": "Framework for terminal user interfaces based on The Elm Architecture.",
      "category": "cli",
      "added": "2026-09-12"
    },
    {
      "repo": "charmbracelet/lipgloss",
      "description": "Style definitions for nice terminal layouts.",
      "category": "cli",
      "added": "2026-09-12"
    },
    {
      "repo": "connectrpc/connect-go",
      "description": "Simple RPC over HTTP/1.1 and HTTP/2 with gRPC compatibility.",
      "category": "rpc-and-api",
      "added": "2026-09-12"
    },
    {
      "repo": "coreos/go-oidc",
      "description": "OpenID Connect client with verification of ID tokens.",
      "category": "auth",
      "added": "2026-09-12"
    },
    {
      "repo": "danielgtaylor/huma",
      "description": "Framework for HTTP APIs with OpenAPI 3 generation and validation.",
      "category": "rpc-and-api",
      "added": "2026-09-12"
    },
    {
      "repo": "DATA-DOG/go-sqlmock",
      "description": "SQL driver mock for testing database interactions without a real database.",
      "category": "testing",
      "added": "2026-09-12"
    },
    {
      "repo": "dgraph-io/badger",
      "description": "Embeddable, persistent key-value store built on LSM trees.",
      "category": "databases",
      "added": "2026-09-12"
    },
    {
      "repo": "dgraph-io/ristretto",
      "description": "Concurrent cache with admission and eviction policies tuned for hit ratio.",
      "category": "caching",
      "added": "2026-09-12"
    },
    {
      "repo": "dominikh/go-tools",
      "description": "Staticcheck and other advanced static analysis tools.",
      "category": "developer-tools",
      "added": "2026-09-12"
    },
    {
      "repo": "dustin/go-humanize",
      "description": "Formatters for byte sizes, times, numbers and ordinals in human-readable form.",
      "category": "utilities",
      "added": "2026-09-12"
    },
    {
      "repo": "ent/ent",
      "description": "Entity framework for modeling data as a graph schema with generated code.",
      "category": "databases",
      "added": "2026-09-12"
    },
    {
      "repo": "etcd-io/bbolt",
      "description": "Embedded key-value database based on B+ trees.",
      "category": "databases",
      "added": "2026-09-12"
    },
    {
      "repo": "fsnotify/fsnotify",
      "description": "Cross-platform filesystem notifications.",
      "category": "utilities",
      "added": "2026-09-12"
    },
    {
      "repo": "gin-gonic/gin",
      "description": "HTTP web framework with a martini-like API and strong routing performance.",
      "category": "web-frameworks",
      "added": "2026-09-12"
    },
    {
      "repo": "go-chi/chi",
      "description": "Lightweight, idiomatic and composable router built on net/http.",
      "category": "web-frameworks",
      "added": "2026-09-12"
    },
    {
      "repo": "go-delve/delve",
      "description": "Debugger with support for goroutines, breakpoints and remote debugging.",
      "category": "developer-tools",
      "added": "2026-09-12"
    },
    {
      "repo": "go-gorm/gorm",
      "description": "Developer-friendly ORM with associations, hooks, transactions and migrations.",
      "category": "databases",
      "added": "2026-09-12"
    },
    {
      "repo": "go-playground/validator",
      "description": "Struct and field validation using tags, with cross-field and cross-struct rules.",
      "category": "validation",
      "added": "2026-09-12"
    },
    {
      "repo": "go-resty/resty",
      "description": "Feature-rich REST client with retries, middleware and request tracing.",
      "category": "http-clients",
      "added": "2026-09-12"
    },
    {
      "repo": "go-sql-driver/mysql",
      "description": "Driver for MySQL over database/sql.",
      "category": "databases",
      "added": "2026-09-12"
    },
    {
      "repo": "go-task/task",
      "description": "Build tool and task runner with a simple YAML syntax.",
      "category": "developer-tools",
      "added": "2026-09-12"
    },
    {
      "repo": "go-viper/mapstructure",
      "description": "Decoding of generic map values into native structures.",
      "category": "utilities",
      "added": "2026-09-12",
      "exempt": [